{
  "sentence": "Озабоченный и серьезный проснулся Разумихин на другой день в восьмом часу.",
  "tokens": [
    "Озабоченный",
    "и",
    "серьезный",
    "проснулся",
    "Разумихин",
    "на",
    "другой",
    "день",
    "в",
    "восьмом",
    "часу",
    "."
  ],
  "morphs": [
    [],
    [
      {
        "word": "и",
        "lexem": "и",
        "tags": "OpencorporaTag('CONJ')"
      }
    ],
    [],
    [
      {
        "word": "проснулся",
        "lexem": "проснуться",
        "tags": "OpencorporaTag('VERB,perf,intr masc,sing,past,indc')"
      }
    ],
    [
      {
        "word": "разумихин",
        "lexem": "разумихин",
        "tags": "OpencorporaTag('NOUN,anim,masc,Sgtm,Surn sing,nomn')"
      }
    ],
    [
      {
        "word": "на",
        "lexem": "на",
        "tags": "OpencorporaTag('PREP')"
      }
    ],
    [
      {
        "word": "другой",
        "lexem": "другой",
        "tags": "OpencorporaTag('ADJF,Subx,Apro inan,masc,sing,accs')"
      }
    ],
    [
      {
        "word": "день",
        "lexem": "день",
        "tags": "OpencorporaTag('NOUN,inan,masc sing,accs')"
      }
    ],
    [
      {
        "word": "в",
        "lexem": "в",
        "tags": "OpencorporaTag('PREP')"
      }
    ],
    [],
    [],
    []
  ],
  "synts": [
    [
      7,
      6,
      "опред",
      "день",
      "другой"
    ],
    [
      5,
      7,
      "предл",
      "на",
      "день"
    ],
    [
      7,
      8,
      "атриб",
      "день",
      "в"
    ],
    [
      3,
      4,
      "предик",
      "проснулся",
      "разумихин"
    ],
    [
      1,
      3,
      "соч-союзн",
      "и",
      "проснулся"
    ],
    [
      3,
      5,
      "обст",
      "проснулся",
      "на"
    ]
  ]
}