{
  "sentence": "— Мне кажется, — говорила она, — что он что-то подозревает, что он даже знает что-то, — может быть, прочитал какое-нибудь ваше письмо, подобрал ключ к моему столу...",
  "tokens": [
    "—",
    "Мне",
    "кажется",
    ",",
    "—",
    "говорила",
    "она",
    ",",
    "—",
    "что",
    "он",
    "что-то",
    "подозревает",
    ",",
    "что",
    "он",
    "даже",
    "знает",
    "что-то",
    ",",
    "—",
    "может",
    "быть",
    ",",
    "прочитал",
    "какое-нибудь",
    "ваше",
    "письмо",
    ",",
    "подобрал",
    "ключ",
    "к",
    "моему",
    "столу",
    "..."
  ],
  "morphs": [
    [],
    [
      {
        "word": "мне",
        "lexem": "я",
        "tags": "OpencorporaTag('NPRO,1per sing,datv')"
      }
    ],
    [
      {
        "word": "кажется",
        "lexem": "казаться",
        "tags": "OpencorporaTag('VERB,impf,intr sing,3per,pres,indc')"
      }
    ],
    [],
    [],
    [
      {
        "word": "говорила",
        "lexem": "говорить",
        "tags": "OpencorporaTag('VERB,impf,tran femn,sing,past,indc')"
      }
    ],
    [
      {
        "word": "она",
        "lexem": "она",
        "tags": "OpencorporaTag('NPRO,femn,3per,Anph sing,nomn')"
      }
    ],
    [],
    [],
    [
      {
        "word": "что",
        "lexem": "что",
        "tags": "OpencorporaTag('NPRO,neut sing,accs')"
      }
    ],
    [
      {
        "word": "он",
        "lexem": "он",
        "tags": "OpencorporaTag('NPRO,masc,3per,Anph sing,nomn')"
      }
    ],
    [
      {
        "word": "что-то",
        "lexem": "что-то",
        "tags": "OpencorporaTag('NPRO,neut sing,nomn')"
      }
    ],
    [
      {
        "word": "подозревает",
        "lexem": "подозревать",
        "tags": "OpencorporaTag('VERB,impf,tran sing,3per,pres,indc')"
      }
    ],
    [],
    [
      {
        "word": "что",
        "lexem": "что",
        "tags": "OpencorporaTag('NPRO,neut sing,accs')"
      }
    ],
    [
      {
        "word": "он",
        "lexem": "он",
        "tags": "OpencorporaTag('NPRO,masc,3per,Anph sing,nomn')"
      }
    ],
    [],
    [
      {
        "word": "знает",
        "lexem": "знать",
        "tags": "OpencorporaTag('VERB,impf,tran sing,3per,pres,indc')"
      }
    ],
    [
      {
        "word": "что-то",
        "lexem": "что-то",
        "tags": "OpencorporaTag('NPRO,neut sing,nomn')"
      }
    ],
    [],
    [],
    [
      {
        "word": "может",
        "lexem": "мочь",
        "tags": "OpencorporaTag('VERB,impf,intr sing,3per,pres,indc')"
      }
    ],
    [
      {
        "word": "быть",
        "lexem": "быть",
        "tags": "OpencorporaTag('INFN,impf,intr')"
      }
    ],
    [],
    [
      {
        "word": "прочитал",
        "lexem": "прочитать",
        "tags": "OpencorporaTag('VERB,perf,tran masc,sing,past,indc')"
      }
    ],
    [
      {
        "word": "какое-нибудь",
        "lexem": "какой-нибудь",
        "tags": "OpencorporaTag('ADJF,Apro neut,sing,accs')"
      }
    ],
    [
      {
        "word": "ваше",
        "lexem": "ваш",
        "tags": "OpencorporaTag('ADJF,Apro neut,sing,accs')"
      }
    ],
    [
      {
        "word": "письмо",
        "lexem": "письмо",
        "tags": "OpencorporaTag('NOUN,inan,neut sing,nomn')"
      }
    ],
    [],
    [
      {
        "word": "подобрал",
        "lexem": "подобрать",
        "tags": "OpencorporaTag('VERB,perf,tran masc,sing,past,indc')"
      }
    ],
    [
      {
        "word": "ключ",
        "lexem": "ключ",
        "tags": "OpencorporaTag('NOUN,inan,masc sing,accs')"
      }
    ],
    [
      {
        "word": "к",
        "lexem": "к",
        "tags": "OpencorporaTag('PREP')"
      }
    ],
    [
      {
        "word": "моему",
        "lexem": "мой",
        "tags": "OpencorporaTag('ADJF,Apro masc,sing,datv')"
      }
    ],
    [
      {
        "word": "столу",
        "lexem": "стол",
        "tags": "OpencorporaTag('NOUN,inan,masc sing,datv')"
      }
    ],
    []
  ],
  "synts": [
    [
      33,
      32,
      "опред",
      "столу",
      "моему"
    ],
    [
      31,
      33,
      "предл",
      "к",
      "столу"
    ],
    [
      30,
      31,
      "атриб",
      "ключ",
      "к"
    ],
    [
      5,
      6,
      "предик",
      "говорила",
      "она"
    ],
    [
      12,
      11,
      "предик",
      "подозревает",
      "что-то"
    ],
    [
      17,
      15,
      "предик",
      "знает",
      "он"
    ],
    [
      21,
      18,
      "предик",
      "может",
      "что-то"
    ],
    [
      29,
      27,
      "предик",
      "подобрал",
      "письмо"
    ],
    [
      2,
      1,
      "1-компл",
      "кажется",
      "мне"
    ],
    [
      5,
      9,
      "1-компл",
      "говорила",
      "что"
    ],
    [
      12,
      14,
      "1-компл",
      "подозревает",
      "что"
    ],
    [
      29,
      30,
      "1-компл",
      "подобрал",
      "ключ"
    ],
    [
      9,
      10,
      "подч-союзн",
      "что",
      "он"
    ],
    [
      14,
      17,
      "подч-союзн",
      "что",
      "знает"
    ],
    [
      17,
      21,
      "сочин",
      "знает",
      "может"
    ],
    [
      24,
      29,
      "сочин",
      "прочитал",
      "подобрал"
    ],
    [
      21,
      22,
      "обст",
      "может",
      "быть"
    ],
    [
      2,
      33,
      "присвяз",
      "кажется",
      "столу"
    ]
  ]
}