{
  "sentence": "Разумихин донес ему, что тот спит, как сурок.",
  "tokens": [
    "Разумихин",
    "донес",
    "ему",
    ",",
    "что",
    "тот",
    "спит",
    ",",
    "как",
    "сурок",
    "."
  ],
  "morphs": [
    [
      {
        "word": "разумихин",
        "lexem": "разумихин",
        "tags": "OpencorporaTag('NOUN,anim,masc,Sgtm,Surn sing,nomn')"
      }
    ],
    [
      {
        "word": "донёс",
        "lexem": "донести",
        "tags": "OpencorporaTag('VERB,perf,tran masc,sing,past,indc')"
      }
    ],
    [
      {
        "word": "ему",
        "lexem": "он",
        "tags": "OpencorporaTag('NPRO,masc,3per,Anph sing,datv')"
      }
    ],
    [],
    [
      {
        "word": "что",
        "lexem": "что",
        "tags": "OpencorporaTag('NPRO,neut sing,nomn')"
      }
    ],
    [
      {
        "word": "тот",
        "lexem": "тот",
        "tags": "OpencorporaTag('ADJF,Subx,Apro,Anph masc,sing,nomn')"
      }
    ],
    [
      {
        "word": "спит",
        "lexem": "спать",
        "tags": "OpencorporaTag('VERB,impf,intr sing,3per,pres,indc')"
      },
      {
        "word": "спит",
        "lexem": "спить",
        "tags": "OpencorporaTag('PRTS,perf,past,pssv masc,sing')"
      }
    ],
    [],
    [
      {
        "word": "как",
        "lexem": "как",
        "tags": "OpencorporaTag('CONJ')"
      }
    ],
    [
      {
        "word": "сурок",
        "lexem": "сурок",
        "tags": "OpencorporaTag('NOUN,anim,masc sing,nomn')"
      }
    ],
    []
  ],
  "synts": [
    [
      1,
      0,
      "предик",
      "донёс",
      "разумихин"
    ],
    [
      6,
      4,
      "предик",
      "спит",
      "что"
    ],
    [
      1,
      2,
      "1-компл",
      "донёс",
      "ему"
    ],
    [
      6,
      5,
      "1-компл",
      "спит",
      "тот"
    ],
    [
      8,
      9,
      "подч-союзн",
      "как",
      "сурок"
    ],
    [
      8,
      9,
      "сравн-союзн",
      "как",
      "сурок"
    ],
    [
      2,
      6,
      "релят",
      "ему",
      "спит"
    ],
    [
      2,
      6,
      "релят",
      "ему",
      "спит"
    ]
  ]
}