{
  "sentence": "А лошади уже стоят у крыльца.",
  "tokens": [
    "А",
    "лошади",
    "уже",
    "стоят",
    "у",
    "крыльца",
    "."
  ],
  "morphs": [
    [
      {
        "word": "а",
        "lexem": "а",
        "tags": "OpencorporaTag('CONJ')"
      }
    ],
    [
      {
        "word": "лошади",
        "lexem": "лошадь",
        "tags": "OpencorporaTag('NOUN,anim,femn plur,nomn')"
      }
    ],
    [
      {
        "word": "уже",
        "lexem": "узкий",
        "tags": "OpencorporaTag('COMP,Qual')"
      }
    ],
    [
      {
        "word": "стоят",
        "lexem": "стоять",
        "tags": "OpencorporaTag('VERB,impf,intr plur,3per,pres,indc')"
      },
      {
        "word": "стоят",
        "lexem": "стоить",
        "tags": "OpencorporaTag('VERB,impf,tran plur,3per,pres,indc')"
      }
    ],
    [
      {
        "word": "у",
        "lexem": "у",
        "tags": "OpencorporaTag('PREP')"
      }
    ],
    [
      {
        "word": "крыльца",
        "lexem": "крыльцо",
        "tags": "OpencorporaTag('NOUN,inan,neut sing,gent')"
      },
      {
        "word": "крыльца",
        "lexem": "крыльцо",
        "tags": "OpencorporaTag('NOUN,inan,neut plur,accs')"
      }
    ],
    []
  ],
  "synts": [
    [
      4,
      5,
      "предл",
      "у",
      "крыльца"
    ],
    [
      4,
      5,
      "предл",
      "у",
      "крыльца"
    ],
    [
      2,
      1,
      "предик",
      "уже",
      "лошади"
    ],
    [
      3,
      4,
      "1-компл",
      "стоят",
      "у"
    ],
    [
      0,
      2,
      "соч-союзн",
      "а",
      "уже"
    ],
    [
      3,
      4,
      "обст",
      "стоят",
      "у"
    ]
  ]
}