{
  "sentence": "Что сделать, чем помочь?",
  "tokens": [
    "Что",
    "сделать",
    ",",
    "чем",
    "помочь",
    "?"
  ],
  "morphs": [
    [
      {
        "word": "что",
        "lexem": "что",
        "tags": "OpencorporaTag('NPRO,neut sing,accs')"
      }
    ],
    [
      {
        "word": "сделать",
        "lexem": "сделать",
        "tags": "OpencorporaTag('INFN,perf,tran')"
      }
    ],
    [],
    [
      {
        "word": "чем",
        "lexem": "что",
        "tags": "OpencorporaTag('NPRO,neut sing,ablt')"
      }
    ],
    [
      {
        "word": "помочь",
        "lexem": "помочь",
        "tags": "OpencorporaTag('INFN,perf,intr')"
      },
      {
        "word": "помочь",
        "lexem": "помочь",
        "tags": "OpencorporaTag('NOUN,inan,femn,Arch sing,nomn')"
      }
    ],
    []
  ],
  "synts": [
    [
      4,
      3,
      "агент",
      "помочь",
      "чем"
    ],
    [
      1,
      0,
      "1-компл",
      "сделать",
      "что"
    ],
    [
      3,
      4,
      "подч-союзн",
      "чем",
      "помочь"
    ],
    [
      3,
      4,
      "подч-союзн",
      "чем",
      "помочь"
    ],
    [
      3,
      4,
      "инф-союзн",
      "чем",
      "помочь"
    ]
  ]
}