{
  "sentence": "Сальная свеча пылала дрожащим хмурым пламенем.",
  "tokens": [
    "Сальная",
    "свеча",
    "пылала",
    "дрожащим",
    "хмурым",
    "пламенем",
    "."
  ],
  "morphs": [
    [
      {
        "word": "сальная",
        "lexem": "сальный",
        "tags": "OpencorporaTag('ADJF,Qual femn,sing,nomn')"
      }
    ],
    [
      {
        "word": "свеча",
        "lexem": "свеча",
        "tags": "OpencorporaTag('NOUN,inan,femn sing,nomn')"
      }
    ],
    [
      {
        "word": "пылала",
        "lexem": "пылать",
        "tags": "OpencorporaTag('VERB,impf,intr femn,sing,past,indc')"
      }
    ],
    [
      {
        "word": "дрожащим",
        "lexem": "дрожать",
        "tags": "OpencorporaTag('PRTF,impf,intr,pres,actv neut,sing,ablt')"
      }
    ],
    [
      {
        "word": "хмурым",
        "lexem": "хмурый",
        "tags": "OpencorporaTag('ADJF,Qual neut,sing,ablt')"
      }
    ],
    [
      {
        "word": "пламенем",
        "lexem": "пламя",
        "tags": "OpencorporaTag('NOUN,inan,neut sing,ablt')"
      }
    ],
    []
  ],
  "synts": [
    [
      1,
      0,
      "опред",
      "свеча",
      "сальная"
    ],
    [
      5,
      3,
      "опред",
      "пламенем",
      "дрожащим"
    ],
    [
      5,
      4,
      "опред",
      "пламенем",
      "хмурым"
    ],
    [
      2,
      5,
      "агент",
      "пылала",
      "пламенем"
    ],
    [
      2,
      1,
      "предик",
      "пылала",
      "свеча"
    ],
    [
      3,
      5,
      "1-компл",
      "дрожащим",
      "пламенем"
    ]
  ]
}