{
  "sentence": "— Я уверена, что она достойная была девушка, — коротко заметила Авдотья Романовна.",
  "tokens": [
    "—",
    "Я",
    "уверена",
    ",",
    "что",
    "она",
    "достойная",
    "была",
    "девушка",
    ",",
    "—",
    "коротко",
    "заметила",
    "Авдотья",
    "Романовна",
    "."
  ],
  "morphs": [
    [],
    [],
    [
      {
        "word": "уверена",
        "lexem": "уверить",
        "tags": "OpencorporaTag('PRTS,perf,past,pssv femn,sing')"
      }
    ],
    [],
    [
      {
        "word": "что",
        "lexem": "что",
        "tags": "OpencorporaTag('NPRO,neut sing,nomn')"
      }
    ],
    [
      {
        "word": "она",
        "lexem": "она",
        "tags": "OpencorporaTag('NPRO,femn,3per,Anph sing,nomn')"
      }
    ],
    [
      {
        "word": "достойная",
        "lexem": "достойный",
        "tags": "OpencorporaTag('ADJF,Qual femn,sing,nomn')"
      }
    ],
    [
      {
        "word": "была",
        "lexem": "быть",
        "tags": "OpencorporaTag('VERB,impf,intr femn,sing,past,indc')"
      }
    ],
    [
      {
        "word": "девушка",
        "lexem": "девушка",
        "tags": "OpencorporaTag('NOUN,anim,femn sing,nomn')"
      }
    ],
    [],
    [],
    [
      {
        "word": "коротко",
        "lexem": "коротко",
        "tags": "OpencorporaTag('ADVB')"
      }
    ],
    [
      {
        "word": "заметила",
        "lexem": "заметить",
        "tags": "OpencorporaTag('VERB,perf,tran femn,sing,past,indc')"
      }
    ],
    [
      {
        "word": "авдотья",
        "lexem": "авдотья",
        "tags": "OpencorporaTag('NOUN,anim,femn,Name sing,nomn')"
      }
    ],
    [
      {
        "word": "романовна",
        "lexem": "романович",
        "tags": "OpencorporaTag('NOUN,anim,femn,Patr sing,nomn')"
      }
    ],
    []
  ],
  "synts": [
    [
      5,
      6,
      "опред",
      "она",
      "достойная"
    ],
    [
      2,
      4,
      "предик",
      "уверена",
      "что"
    ],
    [
      7,
      5,
      "предик",
      "была",
      "она"
    ],
    [
      12,
      8,
      "предик",
      "заметила",
      "девушка"
    ],
    [
      4,
      7,
      "подч-союзн",
      "что",
      "была"
    ],
    [
      7,
      12,
      "сочин",
      "была",
      "заметила"
    ],
    [
      12,
      11,
      "обст",
      "заметила",
      "коротко"
    ],
    [
      7,
      13,
      "присвяз",
      "была",
      "авдотья"
    ],
    [
      7,
      14,
      "присвяз",
      "была",
      "романовна"
    ]
  ]
}