{
  "sentence": "А там, во дворе, уже запрягают лошадей.",
  "tokens": [
    "А",
    "там",
    ",",
    "во",
    "дворе",
    ",",
    "уже",
    "запрягают",
    "лошадей",
    "."
  ],
  "morphs": [
    [
      {
        "word": "а",
        "lexem": "а",
        "tags": "OpencorporaTag('CONJ')"
      }
    ],
    [],
    [],
    [
      {
        "word": "во",
        "lexem": "в",
        "tags": "OpencorporaTag('PREP Vpre')"
      }
    ],
    [
      {
        "word": "дворе",
        "lexem": "двор",
        "tags": "OpencorporaTag('NOUN,inan,masc sing,loct')"
      }
    ],
    [],
    [
      {
        "word": "уже",
        "lexem": "узкий",
        "tags": "OpencorporaTag('COMP,Qual')"
      }
    ],
    [
      {
        "word": "запрягают",
        "lexem": "запрягать",
        "tags": "OpencorporaTag('VERB,impf,tran plur,3per,pres,indc')"
      }
    ],
    [
      {
        "word": "лошадей",
        "lexem": "лошадь",
        "tags": "OpencorporaTag('NOUN,anim,femn plur,accs')"
      }
    ],
    []
  ],
  "synts": [
    [
      3,
      4,
      "предл",
      "во",
      "дворе"
    ],
    [
      7,
      3,
      "несобст-агент",
      "запрягают",
      "во"
    ],
    [
      7,
      8,
      "1-компл",
      "запрягают",
      "лошадей"
    ],
    [
      0,
      6,
      "соч-союзн",
      "а",
      "уже"
    ]
  ]
}