{
  "sentence": "Грусть, одиночество, скучные, одинаковые дни в чужой семье.",
  "tokens": [
    "Грусть",
    ",",
    "одиночество",
    ",",
    "скучные",
    ",",
    "одинаковые",
    "дни",
    "в",
    "чужой",
    "семье",
    "."
  ],
  "morphs": [
    [
      {
        "word": "грусть",
        "lexem": "грусть",
        "tags": "OpencorporaTag('NOUN,inan,femn,Sgtm sing,accs')"
      },
      {
        "word": "грусть",
        "lexem": "грусть",
        "tags": "OpencorporaTag('NOUN,inan,femn,Sgtm sing,nomn')"
      }
    ],
    [],
    [
      {
        "word": "одиночество",
        "lexem": "одиночество",
        "tags": "OpencorporaTag('NOUN,inan,neut sing,nomn')"
      },
      {
        "word": "одиночество",
        "lexem": "одиночество",
        "tags": "OpencorporaTag('NOUN,inan,neut sing,accs')"
      }
    ],
    [],
    [
      {
        "word": "скучные",
        "lexem": "скучный",
        "tags": "OpencorporaTag('ADJF,Qual inan,plur,accs')"
      },
      {
        "word": "скучные",
        "lexem": "скучный",
        "tags": "OpencorporaTag('ADJF,Qual plur,nomn')"
      }
    ],
    [],
    [
      {
        "word": "одинаковые",
        "lexem": "одинаковый",
        "tags": "OpencorporaTag('ADJF,Qual plur,nomn')"
      },
      {
        "word": "одинаковые",
        "lexem": "одинаковый",
        "tags": "OpencorporaTag('ADJF,Qual inan,plur,accs')"
      }
    ],
    [
      {
        "word": "дни",
        "lexem": "день",
        "tags": "OpencorporaTag('NOUN,inan,masc plur,accs')"
      },
      {
        "word": "дни",
        "lexem": "день",
        "tags": "OpencorporaTag('NOUN,inan,masc plur,nomn')"
      }
    ],
    [
      {
        "word": "в",
        "lexem": "в",
        "tags": "OpencorporaTag('PREP')"
      }
    ],
    [
      {
        "word": "чужой",
        "lexem": "чужой",
        "tags": "OpencorporaTag('ADJF,Subx femn,sing,loct')"
      }
    ],
    [
      {
        "word": "семье",
        "lexem": "семья",
        "tags": "OpencorporaTag('NOUN,inan,femn sing,loct')"
      },
      {
        "word": "семье",
        "lexem": "семья",
        "tags": "OpencorporaTag('NOUN,inan,femn sing,datv')"
      }
    ],
    []
  ],
  "synts": [
    [
      10,
      9,
      "опред",
      "семье",
      "чужой"
    ],
    [
      8,
      10,
      "предл",
      "в",
      "семье"
    ],
    [
      8,
      10,
      "предл",
      "в",
      "семье"
    ],
    [
      7,
      8,
      "распред",
      "дни",
      "в"
    ],
    [
      7,
      8,
      "распред",
      "дни",
      "в"
    ],
    [
      0,
      2,
      "об-аппоз",
      "грусть",
      "одиночество"
    ],
    [
      0,
      2,
      "об-аппоз",
      "грусть",
      "одиночество"
    ],
    [
      0,
      2,
      "сочин",
      "грусть",
      "одиночество"
    ],
    [
      0,
      2,
      "сочин",
      "грусть",
      "одиночество"
    ],
    [
      4,
      6,
      "сочин",
      "скучные",
      "одинаковые"
    ],
    [
      4,
      6,
      "сочин",
      "скучные",
      "одинаковые"
    ]
  ]
}