{
  "sentence": "Да ни за что же на свете!",
  "tokens": [
    "Да",
    "ни",
    "за",
    "что",
    "же",
    "на",
    "свете",
    "!"
  ],
  "morphs": [
    [],
    [
      {
        "word": "ни",
        "lexem": "ни",
        "tags": "OpencorporaTag('CONJ')"
      }
    ],
    [],
    [
      {
        "word": "что",
        "lexem": "что",
        "tags": "OpencorporaTag('NPRO,neut sing,accs')"
      }
    ],
    [],
    [
      {
        "word": "на",
        "lexem": "на",
        "tags": "OpencorporaTag('PREP')"
      }
    ],
    [
      {
        "word": "свете",
        "lexem": "свет",
        "tags": "OpencorporaTag('NOUN,inan,masc,Sgtm sing,loct')"
      }
    ],
    []
  ],
  "synts": [
    [
      5,
      6,
      "предл",
      "на",
      "свете"
    ],
    [
      1,
      3,
      "соч-союзн",
      "ни",
      "что"
    ]
  ]
}